Id,cuitan,sentimen
361,"Parah, nggak gampang diakses bagi wajib pajak.",Negatif
362,"Suka banget karena UI nya sangat bersih, bikin kerjaan cepet kelar.",Positif
363,"Hari ini server down awal bulan, mohon dievaluasi.",Negatif
364,"udah seharian gagal upload csv berulang, mohon dievaluasi.",Negatif
365,"setelah pake coretax, semoga bug nya ilang bulan depan supaya kita ga telat lapor.",Netral
366,"bikin emosi, sangat sangat mengecewakan, gak bisa lapor sama sekali.",Negatif
367,"suka banget karena antarmuka mudah dipahami, wajib pajak jadi tenang.",Positif
368,"setelah pake coretax, semoga bug nya ilang bulan depan untuk layanan djp yang lebih baik.",Netral
369,"Wah sekarang sistem pajak ini tidak lelet kaya dulu loh.",Positif
370,"Sistem coretax lumayan lah, yah biasa aja sih.",Netral
371,"Web e-faktur baru lancar banget jaya untuk urus SPT.",Positif
372,"sejauh ini cukup memadai, kadang lancar kadang error.",Netral
373,"parah, tidak user friendly buat lapor spt.",Negatif
374,"Hari ini mau coba akses coretax ada yang tau caranya?",Netral
375,"Parah bgt sangat sangat mengecewakan, gak bisa lapor sama sekali.",Negatif
376,"Udah seharian loading muter terus gak selesai, deadline makin mepet nih.",Negatif
377,"Nanti malam login DJP online siap-siap aja deh.",Netral
378,"Menurutku cukup memadai, tapi masih ada bug sedikit.",Netral
379,"Sejauh ini cukup untuk dasar, buat lapor bulanan.",Netral
380,"Aduh Coretax buruk sekali parah, tiap awal bulan pasti begini.",Negatif
381,"Akhirnya sistem pajak ini bukan aplikasi buruk sama sekali.",Positif
382,"Update baru gak lancar dipake malah nambah beban.",Negatif
383,"Akhirnya aplikasi DJP bukan aplikasi buruk loh.",Positif
384,"Hari ini login DJP online siap-siap aja deh.",Netral
385,"Aplikasi DJP lancar banget jaya pokoknya mantap bgt.",Positif
386,"Kenyataannya Coretax tidak membantu sama sekali.",Negatif
387,"Menurut saya fitur Coretax lengkap, bikin kerjaan cepet kelar.",Positif
388,"suka banget karena antarmuka mudah dipahami, gak pusing lagi ngerjain pajak.",Positif
389,"Parah bgt Coretax buruk sekali parah, gak bisa lapor sama sekali.",Negatif
390,"keren, coretax gak ribet lagi sama sekali.",Positif
391,"Bagus deh antarmuka mudah dipahami, gak pusing lagi ngerjain pajak.",Positif
392,"Web e-faktur baru benar-benar gampang untuk urus SPT.",Positif
393,"Udah seharian gagal upload CSV berulang, admin tolong segera perbaiki!",Negatif
394,"Meskipun baru, berharap kedepannya lancar untuk layanan DJP yang lebih baik.",Netral
395,"Parah bgt sangat sangat mengecewakan, tiap awal bulan pasti begini.",Negatif
396,"Sistem coretax cukup untuk dasar, tapi masih ada bug sedikit.",Netral
397,"Kenyataannya Coretax tidak user friendly bagi wajib pajak.",Negatif
398,"Ya kalau dibilang sih lumayan membantu, kadang lancar kadang error.",Netral
399,"melihat update ini, turut berkembang terus untuk layanan djp yang lebih baik.",Netral
400,"Besok jadwal lapor spt udah deket nih di laptop.",Netral
